Headline,Date
U.S. stocks rally; Dow gains most in 5 weeks,2014-05-21
Two stocks that have caught the eye of institutions,2014-05-22
Apple’s iTunes Radio moves in for the kill,2014-05-28
Twitter rises as other tech stocks retreat,2014-05-28
"Apple, Palo Alto Networks lead slate of tech gains",2014-05-29
"The bull/bear case for Netflix, May’s best big stock",2014-05-30
3 expensive stocks worth every penny,2014-05-30
Apple gains more support with conference on tap,2014-05-30
Driver’s ed teachers laugh at Google’s car,2014-06-01
Apple retreats on last day before stock split,2014-06-06
Apple’s first affordable product: its stock,2014-06-08
"Netflix shareholders reject chairman, CEO split",2014-06-09
"Apple, eBay diverge in mild tech trading",2014-06-10
"Tech stocks gain behind Amazon, Synaptics",2014-06-11
6 tech innovations debuting at the World Cup,2014-06-12
Does streaming music make Amazon Prime’s $99 price tag worth it?,2014-06-12
With Amazon streaming comes larger data bills,2014-06-12
Yahoo slumps while most tech stocks rally,2014-06-16
Netflix among tech gainers on new Morgan Stanley rating,2014-06-17
Netflix among gainers as tech stocks advance,2014-06-17
Oracle leads tech action with $5.3 billion Micros buy,2014-06-23
5 industries that millennials are destroying,2014-06-23
Netflix signs Chelsea Handler for a late-night talk show,2014-06-24
Here’s what you’ll save by ditching cable TV,2014-06-24
"If you haven’t cut the cord on cable TV, you should",2014-06-24
"Google, Zulily lead tech gains",2014-06-25
Whatever happened to the cable TV revolution?,2014-06-26
Netflix shares up 3.8% in premarket trade,2014-07-01
Netflix drives 'sustained outperformance': Goldman,2014-07-01
Netflix shares gain 3.7% to top S&P 500,2014-07-01
Twitter gains on new CFO; GM sales up in June,2014-07-01
"U.S. stocks: S&P 500, Dow set fresh records",2014-07-01
How to pay less for everything,2014-07-04
"Techs slip, but Applied Materials rallies",2014-07-07
Emmys underscore who’s providing the buzz,2014-07-10
Netflix scores 31 Emmy nominations,2014-07-10
‘Game of Thrones’ and ‘Fargo’ head Emmy pack,2014-07-10
Techs gain broadly; Apple rises on analyst upgrade,2014-07-14
Apple and IBM: From ‘Think’ to ‘Think Different’ to ‘Think Again’,2014-07-16
Google spurs tech gains following earnings,2014-07-18
Netflix confirms $1-a-month price hike,2014-07-21
Netflix price hike doesn’t deter subscribers,2014-07-21
"Updates, advisories and surprises",2014-07-21
"Netflix says ""Orange Is The New Black"" reaction helped results",2014-07-21
U.S. stocks end lower amid geopolitical tensions,2014-07-21
Netflix earnings surge on strong subscriber gains,2014-07-21
Netflix shares rise 0.8% in after-hours trade after earnings,2014-07-21
Netflix reports earnings of $71 million,2014-07-21
Netflix adds 1.69 million streaming subscribers,2014-07-21
Netflix Q2 eps is $1.15,2014-07-21
Netflix results to depend on new-subscriber figures,2014-07-21
"EMC, GoPro jump; BB&T, DaVita, Six Flags sink",2014-07-21
"Netflix, EMC lead tech gainers",2014-07-21
Netflix rises in mixed day for tech stocks,2014-07-21
"Netflix jumps 2.4%, among S&P 500's biggest gainers",2014-07-21
The market in a minute: Be long or be wrong?,2014-07-21
"Small caps’ slump, Ukraine fears may hold up market",2014-07-21
Netflix sales rise 25% to $1.34 billion,2014-07-21
"Chipotle tops S&P 500, Herbalife ignores ‘death blow’",2014-07-22
"Updates, advisories and surprises",2014-07-22
"Apple, Microsoft on the rise with earnings on tap",2014-07-22
"Apple, Microsoft rise ahead of earnings reports",2014-07-22
"It’s a ‘golden age’ for activist investors, but not us",2014-07-22
Zillow’s $3.5 billion Trulia buy leads tech action,2014-07-28
Twitter among tech gainers with earnings on tap,2014-07-29
Twitter needs profits but mostly it needs a cult leader,2014-07-29
‘Seinfeld’ is worth a lot to Netflix,2014-07-29
Tech stocks easeahead of Twitter earnings,2014-07-29
"Updates, advisories and surprises",2014-07-29
"LinkedIn, Expedia rise in otherwise weak tech session",2014-08-01
Tech stocks cuts losses with Groupon on tap,2014-08-05
Disney’s profits are far from frozen,2014-08-05
Yahoo picks former Netflix executive to lead IT operations,2014-08-06
"Groupon, Sprint losses stand out among tech stocks",2014-08-06
Tech sector ends day in the red,2014-08-07
"Apple, Facebook, Netflix rise in early tech rally",2014-08-07
Netflix gains on CEO’s Facebook post; Fox up on results,2014-08-07
Dow drops to close at 3-month low,2014-08-07
Nvidia’s gains stand out among tech stocks,2014-08-08
Here’s my obligatory column that says stocks will crash,2014-08-11
Priceline rises early to highlight tech gains,2014-08-11
Priceline among gainers as tech stocks rally,2014-08-11
Tech stocks start week off with broad gains,2014-08-18
"Apple, Netflix help tech stocks start week with gains",2014-08-18
"Nasdaq breaks out, reaches less-charted territory",2014-08-19
"Nasdaq breaks out, reaches less-charted territory",2014-08-19
"Nasdaq breaks out, reaches less-charted territory",2014-08-19
8 milestones that made Google formidable,2014-08-19
"Updates, advisories and surprises",2014-08-21
H-P leads tech gains in wake of earnings report,2014-08-21
"Salesforce, GameStop lead tech stocks",2014-08-22
Facebook among tech decliners after rating cut,2014-08-27
Facebook leads tech stocks lower,2014-08-27
These companies won (or lost) big at the Emmys,2014-08-27
Most Twitch users spend 20 hours a week watching others play games,2014-08-27
"Workday, other tech stocks retreat early",2014-08-28
Apple sheds billions; CVS extinguishes tobacco sales,2014-09-03
Cable companies should be afraid of this trend,2014-09-03
Netflix shares jump 2%; hit record intraday high of $486.78,2014-09-03
More reasons to like the Nasdaq in September,2014-09-04
Stock-picking gains traction as volatility looms,2014-09-07
Netflix shares extend gains to add 1.1%,2014-09-09
Netflix shares rise to record high after analyst lifts price target,2014-09-09
Revolutionary wearables stock that’s been around for a while,2014-09-09
Websites to protest net neutrality plan,2014-09-10
Two tech stocks with big potential,2014-09-11
"Apple, eBay gains can’t blunt other tech losses",2014-09-12
Tech stocks fall; Microsoft among decliners,2014-09-15
U.S. stocks end lower; tech and small-caps lead losses,2014-09-15
"Microsoft, Google among tech stocks in the red",2014-09-15
Morgan Stanley drags on Tesla; RadioShack surges on CFO exit,2014-09-15
10 rock-solid stocks for conservative investors,2014-09-17
Keep an eye on these leaders for market cues,2014-09-18
"Apple, Amazon lead broad tech gains",2014-09-18
iPhone 6 sales help Apple sidestep broad tech losses,2014-09-22
"Apple, Netflix gain in early tech-sector trading",2014-09-23
"Apple, GoPro rise, but broader techs add to losses",2014-09-23
GoPro rises amid broad tech gains,2014-09-24
Yahoo shares seen as overvalued without Alibaba hype,2014-09-25
The ominous volatility burst and a trend to consider when picking those shorts,2014-09-30
Netflix to deliver another haymaker to Hollywood,2014-09-30
New Netflix movie to kick Hollywood where it hurts,2014-10-01
"During times like these, cash is king",2014-10-02
"Crouching Tiger, Adam Sandler: Netflix goes Hollywood",2014-10-02
It’s the final episode for Redbox Instant,2014-10-06
Short people cash in as Apple beckons ahead of the ‘Zombie Apocalypse’,2014-10-07
"Yahoo, Facebook among early tech decliners",2014-10-07
"Yahoo, H-P decline as tech stocks fall",2014-10-07
Tech stocks show weakness in early trading,2014-10-08
Tech stocks turn it around and record big gains,2014-10-08
Apple one of few gainers on down day for tech stocks,2014-10-09
Earnings under pressure from stronger U.S. dollar,2014-10-12
BTIG raises Netflix rating to buy,2014-10-13
AMD shares drop after hours,2014-10-13
The market in a minute: Schizophrenic action,2014-10-13
"BTIG upgrades Netflix to buy, sets price target at $600",2014-10-13
All the reasons to sell this market are enough to draw a guy in,2014-10-14
Tech stocks rise; Intel tops estimates,2014-10-14
Netflix investors get dose of ’Groundhog Day’,2014-10-15
Netflix reports disappointing number of new users,2014-10-15
"U.S. stocks cut losses in harrowing, volatile session",2014-10-15
Netflix hits a bump on the way to TV-streaming dominance,2014-10-15
"Updates, advisories and surprises",2014-10-15
Netflix plunges 23% in after-hours as new members fall short,2014-10-15
Netflix Q4 streaming sales forecast is $1.31 bln,2014-10-15
Netflix Q4 EPS forecast is 44 cents,2014-10-15
Netflix adds 3.02 mln new subscribers; had forecast 3.69 mln,2014-10-15
Netflix Q3 EPS is 96 cents vs 52 cents a year ago,2014-10-15
Netflix shares plunge after latest earnings report,2014-10-15
Netflix FactSet estimate 92 cents; total sales $1.41 bln,2014-10-15
The potential for 10 years of negative returns as fear takes hold,2014-10-15
"Intel, Netflix among decliners as tech stocks stumble",2014-10-15
"Intel, Netflix in the red as tech stocks retreat",2014-10-15
"Netflix, eBay, American Express on tap after hours",2014-10-15
What to look for in Netflix earnings,2014-10-15
HBO cuts out the middle man with streaming service,2014-10-15
HBO to take on Netflix with streaming service,2014-10-15
Netflix Q3 streaming sales: $1.22 billion vs $884 mln,2014-10-15
"Updates, advisories and surprises",2014-10-16
U.S. stocks end marginally higher; small caps rally,2014-10-16
Analysts still bullish on Netflix as shares tumble,2014-10-16
"Energy stocks extend wild ride, soar up to 15% today",2014-10-16
Recent stock-market action is a good start,2014-10-16
"‘Darkest before the dawn’ applies to bad Octobers, and gold $10,000",2014-10-16
Netflix sinks after results; Chesapeake soars,2014-10-16
Netflix losses stand out as techs swoon,2014-10-16
Netflix shares slump 23% in wake of quarterly results,2014-10-16
Netflix upgraded to hold from underperform by Jefferies,2014-10-16
"Wall Street, Netflix both take a pounding",2014-10-16
Netflix shares fall 25% in early premarket trade,2014-10-16
Jefferies no longer bearish on Netflix after share price plunge,2014-10-16
Morgan Stanley climbs after earnings; Urban Outfitters slides,2014-10-17
"Updates, advisories and surprises",2014-10-20
Why the stocks you’re buying now may be the riskiest,2014-10-20
"Apple gains, IBM losses highlight tech trading action",2014-10-20
"Apple, IBM spur busy tech session",2014-10-20
What correction? Two trends show investors warming back up to risk,2014-10-21
"Tech stocks up with Microsoft, Amazon earnings on tap",2014-10-23
Roku said to be working on IPO plan,2014-10-24
How to get Amazon's 'Roku killer' for $19,2014-10-27
What to look for in Time Warner Cable earnings,2014-10-27
Tech stocks rise with Facebook earnings on tap,2014-10-28
YouTube looking at paid subscription service,2014-10-28
Facebook among gainers as tech stocks rally,2014-10-28
"Updates, advisories and surprises",2014-10-28
"Time Warner Cable profit drops, subscriptions wane",2014-10-30
Time Warner Cable’s video subscribers keep on sinking,2014-10-30
Convergence of 2 bullish trends is a can’t-miss combo. Jinx?,2014-11-04
There’s a lot to like about the Nasdaq right now,2014-11-04
"Here’s what’s grounding Netflix, Amazon and other formerly high-flying stocks",2014-11-05
Tech stocks find early going mixed,2014-11-05
"Qualcomm, AOL among early tech decliners",2014-11-06
Tech stocks end Thursday trading session higher,2014-11-06
"Updates, advisories and surprises",2014-11-06
Microsoft. Broadcom among early tech decliners,2014-11-07
Zynga gains in mildly upbeat tech session,2014-11-07
Net neutrality debate sets stage for next fight over usage pricing,2014-11-10
Obama is selling us out on net neutrality,2014-11-10
Cable stocks fall as Obama calls on FCC to protect net neutrality,2014-11-10
Obama issues statement outlining net-neutrality goals,2014-11-10
The trouble with fundamentals,2014-11-11
Weak tech action ahead of Cisco’s earnings,2014-11-12
"Santa rally is on track in the U.S., barring another crisis in Europe",2014-11-12
Alibaba smacks of Twitter and how to ride the closing ramp to profits,2014-11-13
China is more ‘Kung Fu Panda’ than ‘Crouching Tiger’: diplomat,2014-11-14
"Apple, Pandora among early tech gainers",2014-11-14
"Jack Ma, Dick Costolo and Barack Obama bummed us out this week",2014-11-14
The double-edged sword of growth-stock speculation,2014-11-14
"Apple, Pandora gains highlight tech activity",2014-11-14
Apple gains stand out in early tech-sector action,2014-11-17
"Apple touches all-time high, as tech stocks advance",2014-11-17
Newscast: More records broken on Wall Street,2014-11-18
GoPro gains stand out in tech’s advance,2014-11-18
Nielsen to start measuring Netflix viewing,2014-11-19
Netflix pulls plug on Bill Cosby special,2014-11-19
Charts point to higher prices for stocks,2014-11-20
Redbox raising DVD rental price by 25%,2014-11-24
Netflix downgraded to hold from buy at Stifel,2014-11-25
Netflix's stock slips 0.8% in premarket trade after rating downgrade,2014-11-25
Netflix downgraded to hold as U.S. growth slows,2014-11-25
"S&P's laggards: Netflix, Hormel both down nearly 3%",2014-11-25
It's time to get over your fear of the Nasdaq,2014-11-25
Is the next Cisco out there?,2014-11-25
"S&P 500, Dow skid to a halt, over oil, falling confidence",2014-11-25
"A Thanksgiving for the Uber rich and a call to stay clear of Herbalife, glamours",2014-11-26
Streaming TV boxes offer Cyber Monday deals,2014-12-01
Tech stocks take a Cyber Monday beating,2014-12-01
It’s dangerous to bet against this market,2014-12-02
Carbonite leads broad tech gains after takeover bid,2014-12-03
A go-slow market requires a go-slow approach,2014-12-04
"Yahoo, Google get attention from tech investors",2014-12-05
“Peter Pan” not the hook NBC was hoping for,2014-12-05
Should I share my Netflix password?,2014-12-08
EBay a rare gainer in weak tech session,2014-12-08
Liquid growth stocks tell interesting tale,2014-12-09
"‘Birdman,’ ‘Fargo’ lead Golden Globe nominations",2014-12-11
"Jolie, Cruise, Obama among targets of caustic comments in Sony insiders’ email",2014-12-11
Which stocks the billionaires are buying — and selling,2014-12-12
Spending money on these things may make you happier,2014-12-13
"Netflix is a great service, but a poor investment",2014-12-15
Netflix's stock rallies 3.6% after Dish Network integration deal,2014-12-17
Dish Network to integrate Netflix app into its set-top boxes,2014-12-17
This bull market may already be collecting Social Security,2014-12-19
FCC proposes rules for online video services providers,2014-12-19
"Why speculators see opportunity in younger, cyclical stocks",2014-12-26
Key sectors suggest further gains,2014-12-31
5 must-avoid titles coming to Netflix in January,2015-01-02
7 tech products and services that are dead or on life support,2015-01-05
Amazon unveils 13 new shows,2015-01-06
‘Boyhood’ wins Golden Globe for best drama,2015-01-12
Engage sick bags as stormy markets show no signs of calm,2015-01-12
This proves Apple is the stock retail investors love most,2015-01-13
Amazon signs Woody Allen to create a television series,2015-01-13
"Netflix rises 1.6%, among few S&P 500 gainers",2015-01-14
Mobile games now raking in nearly as much revenue as movie box offices,2015-01-14
Amazon’s first hour-long original drama to debut on Feb. 13,2015-01-14
Investors face ‘the worst time ever’ to buy stocks,2015-01-14
"In Amazon, Netflix battle, consumer is the winner",2015-01-14
Sling TV will need help to disrupt pay TV model: analyst,2015-01-14
"U.S. stocks rebound from Swiss shock, but still record weekly loss",2015-01-16
"Intel, Goldman Sachs drop, while Netflix gains",2015-01-16
"As Musk goes to Mars, Bezos heads to Hollywood",2015-01-16
Netflix is the favorite in streaming market,2015-01-16
Netflix's stock up 1.1% in premarket trade after analyst upgrade,2015-01-16
Netflix stock price target raised to $382 from $360 at Cowen,2015-01-16
Netflix upgraded to outperform from market perform at Cowen,2015-01-16
"Netflix's stock rises after Cowen raises rating, price target",2015-01-16
"Earnings, ECB highlight holiday-shortened week",2015-01-19
Netflix sees Q1 net additions 4.05 mln vs. FactSet consensus 3.88 mln,2015-01-20
"Updates, advisories and surprises",2015-01-20
"Netflix surges after earnings, subscriber growth beats",2015-01-20
Netflix adds more users than expected,2015-01-20
Netflix adds more users than expected,2015-01-20
Netflix's stock soars after profits surge past estimates,2015-01-20
Netflix shares up 8% in after-hours trade,2015-01-20
Stocks eke out gains in choppy trade,2015-01-20
Netflix Q4 FactSet EPS consensus 45 cents,2015-01-20
Netflix Q4 net additions 4.33 mln vs. FactSet consensus 3.88 mln,2015-01-20
Netflix Q4 adj. EPS 72 cents,2015-01-20
Netflix Q4 EPS $1.35 vs. 79 cents,2015-01-20
CORRECT: Netflix Q4 sales $1.48 bln vs. $1.18 bln a year ago; FactSet consensus $1.485 bln,2015-01-20
Overstock.com plans streaming-video service,2015-01-20
Is Netflix stuck in earnings stagnation?,2015-01-20
Netflix Q4 FactSet EPS consensus 45 cents,2015-01-20
"EBay shares rise on jobs cuts, Icahn agreement",2015-01-21
Netflix steps up plan for global expansion,2015-01-21
Top performers react to Netflix jumping and IBM tanking,2015-01-21
U.S. stocks extend win streak to three sessions,2015-01-21
"Gold bugs, this may be your moment",2015-01-21
"Netflix's stock set to open at a 3-month high, as analysts lift price targets",2015-01-21
Netflix's stock soars 18% in premarket trade after Q4 results late Monday,2015-01-21
What happens if the ECB pulls a Swiss-style surprise,2015-01-21
Netflix shares soar 17%,2015-01-21
Avoid gambling on earnings results,2015-01-22
SocGen initiates Facebook at sell but rates Google a buy,2015-01-23
"Netflix, Amazon, Hollywood are all vying for your attention — and your money",2015-01-23
Wall Street looks in the mirror ... and sees nothing,2015-01-23
Why today’s stock market is like Netflix,2015-01-23
Icahn on CNBC: Netflix and Apple enjoy 'almost oligopoly' positions,2015-01-28
Amazon starts selling an email service to companies,2015-01-28
Netflix cut to B-plus vs BB-minus at S&P,2015-02-02
S&P cuts Netflix rating further into junk territory,2015-02-02
"10 best, 10 worst S&P 500 stocks so far in 2015",2015-02-02
Anadarko shares slip as earnings miss,2015-02-02
10 companies whose earnings estimates were chopped by analysts,2015-02-03
Insider buys signal Keurig is on to something big,2015-02-03
Netflix preparing to enter Japanese market this year: reports,2015-02-04
Netflix preparing to enter Japanese market: reports,2015-02-04
"Charter Comms posts strong video, ad sales",2015-02-05
"Netflix now available in Cuba, but few Cubans will benefit",2015-02-09
Netflix is now available in Cuba,2015-02-09
"Netflix's 'House of Cards' was briefly available to stream, removed immediately",2015-02-11
My top bet on the ‘Internet of Everything’,2015-02-17
"10 stocks that are pushing the Nasdaq to 5,000",2015-02-23
ETFs are your best way to own Internet stocks,2015-02-23
New net neutrality rules still leave some questions unanswered,2015-02-25
FCC votes in favor of net-neutrality regulations,2015-02-26
FCC votes in favor of net-neutrality regulations,2015-02-26
Best stocks for the App Revolution,2015-02-27
These stock decisions are hobbling your mutual fund,2015-02-27
Lofty Nasdaq doesn’t seem so scary when viewed from the bottom up,2015-03-02
"TiVo reports higher subscriptions, profits",2015-03-03
"Innovation, not easy money, is behind the Nasdaq’s return to 5,000",2015-03-03
The good side of the App Bubble,2015-03-05
Five things to take away from the Apple Event,2015-03-10
"HBO’s online streaming service is coming, but at what cost?",2015-03-12
"Seinfeld nears streaming video deal, yada yada",2015-03-13
American Airlines shares lifted by S&P 500 inclusion,2015-03-16
U.S. stocks rally ahead of Fed meeting; Dow jumps 228 pts.,2015-03-16
Netflix’s stock takes a dive after analyst says sell,2015-03-16
Netflix downgraded to sell from hold at Evercore ISI,2015-03-16
Netflix's stock slumps after downgrade at Evercore ISI,2015-03-16
Netflix's stock drops 1.7% in premarket trade after analyst downgrade,2015-03-16
Netflix stock price target cut to $380 from $450 at Evercore ISI,2015-03-16
Netflix shares slide 2.1%,2015-03-16
"Apple, Sony and the Internet Video Wars",2015-03-17
Can Apple make 46% of you cut the cord?,2015-03-20
"A week of weird decisions, from Apple to Starbucks",2015-03-23
Sonic shares rise after results top Street estimates,2015-03-24
U.S. stocks fall as worries over rate hikes loom,2015-03-24
"Macy’s CFO blames millennials, Netflix and lipstick haters on shifting retail landscape",2015-03-24
Netflix seen as ‘clear winner’ in TV unbundling despite Apple entry,2015-03-24
Netflix stock price target raised to $450 from $400 at Barclays,2015-03-24
Why some aren’t buying the tech bubble talk,2015-03-26
"Netflix axes Friday the 13th, chops Karate Kid from April offerings",2015-03-31
Disruptive technology blurs the lines between industries,2015-04-01
Netflix wants to remind you: Binge responsibly,2015-04-01
Sling TV will offer you HBO content for $15 more a month,2015-04-01
Netflix lands new original mystery-drama 'Montauk',2015-04-02
Elon Musk’s Tesla tweets could tweak social-media rules,2015-04-03
"‘Arrested Development’ will return for 17 more episodes, says Brian Grazer",2015-04-07
What the Fed did and what they should have done,2015-04-07
A few of Cody Willard’s biggest mistakes,2015-04-08
Alcoa shares decline as revenue falls short of Street view,2015-04-08
Netflix CEO’s pay rose 43% last year,2015-04-10
Netflix gets stock upgrade as new show ‘Daredevil’ debuts,2015-04-10
GE rallies on restructuring plan; Apple Watch preorders in spotlight,2015-04-10
"GE is a boring stock, but everyone should own it",2015-04-10
Netflix stock price target raised to $525 from $409 at Citigroup,2015-04-10
Netflix upgraded to buy from neutral at Citigroup,2015-04-10
Netflix's stock rallies 2.7% after analyst upgrade,2015-04-10
B. of A. results crucial to financial sector earnings gains,2015-04-12
"Why Netflix is great, and I still don’t own the stock",2015-04-13
Norfolk Southern shares fall on poor outlook,2015-04-13
U.S. stocks fade as earnings jitters ratchet up,2015-04-13
What to look for in Netflix’s earnings,2015-04-13
Netflix upgrade propels stock to top of S&P 500 gainers,2015-04-13
Netflix shares rally 4.2%,2015-04-13
"The market in a minute: Earnings, data on deck",2015-04-13
NetFlix's stock rallies 4.5% to lead S&P 500 gainers after analyst upgrade,2015-04-13
Netflix stock price target raised to $565 from $370 at UBS,2015-04-13
Netflix upgraded to buy from neutral at UBS,2015-04-13
"Netflix's stock surges after UBS boosts rating, price target",2015-04-13
Big money settles in for an extended bull run,2015-04-14
The trillion-dollar messaging revolution,2015-04-14
Netflix announces audio description tracks after ‘Daredevil’ fans complain,2015-04-14
Netflix surprises on international growth,2015-04-15
Netflix shares jump on subscriber surge,2015-04-15
Netflix says strong dollar hurt revenue in first quarter,2015-04-15
"Netflix adds more users than expected, shares leap",2015-04-15
CORRECT: Neflix Q1 revenue $1.57 bln vs. $1.27 bln; FactSet consensus $1.57 bln,2015-04-15
"Netflix's stock trades well above all-time regular-session high of $489.29, hit Sept. 9",2015-04-15
"Netflix adds more users than expected, shares leap",2015-04-15
"Netflix's stock extends gains, up 13% in after-hours trade after Q1 results",2015-04-15
Netflix Q1 net additions 4.88 mln vs 4.00 mln; FactSet consensus 4.11 mln,2015-04-15
Netflix to recommend stock split to board if shareholders approve authorization,2015-04-15
Netflix to recommend stock split to board if shareholders approve authorization,2015-04-15
Netflix says to seek shareholder approval to increase authorized shares,2015-04-15
Neflix Q1 EPS 38 cents vs. 86 cents; FactSet consensus 63 cents,2015-04-15
Netflix shares up 7% after earnings,2015-04-15
Netflix Q1 subscribers total 62.27 mln vs 48.35 mln; FactSet consensus 62.23 mln,2015-04-15
A one-two punch may be lurking for oil,2015-04-15
How to make sense of this ‘buy the dips’ grind higher stock market,2015-04-16
Netflix shares surge 12% following quarterly results,2015-04-16
Netflix stock price target raised to $600 from $515 at Nomura,2015-04-16
Netflix stock price target raised to $690 from $530 at MKM Partners,2015-04-16
A possible Netflix horror story in 4 charts,2015-04-16
Analysts giddy at Netflix plans for international expansion,2015-04-16
Carl Icahn's $100+ million pay day on Netflix,2015-04-16
"U.S. stocks finish lower amid mixed economic data, earnings",2015-04-16
Mattel shares rally after narrower-than-expected loss,2015-04-16
Netflix stock price target raised to $600 from $565 at UBS,2015-04-16
Netflix stock price target raised to $600 from $550 at RBC Capital,2015-04-16
Netflix stock price target raised to $650 from $535 at Stifel Nicolaus,2015-04-16
Netflix stock price target raised to $900 from $400 at FBR & Co.,2015-04-16
Netflix upgraded to outperform from market perform at FBR & Co.,2015-04-16
Netflix stock price target raised to $585 from $480 at Raymond James,2015-04-16
Netflix stock price target raised to $580 from $500 at Cantor Fitzgerald,2015-04-16
