Headline,Date
Stock index that powered the bull rally enters a bear market — ending the longest period of prosperity in history,2018-12-22
Roku Stock Climbs After Being Called a ‘Top Pick’ for 2019,2018-12-26
The FAANGs Added $185 Billion in Market Value Today,2018-12-26
Court records reveal new details of actor Kevin Spacey’s encounter with Massachusetts teen,2018-12-27
Here’s why the stock market’s big bounce doesn’t mean investors will outrun the bear,2018-12-27
Working More Magic at Disney,2018-12-28
Here’s why the stock market is a ‘hot mess’ — and how January could calm the chaos,2018-12-28
Walt Disney Stock Went Nowhere in 2018,2018-12-28
Market for Streaming Starts to Look a Little Like Cable,2018-12-28
‘Black Mirror: Bandersnatch’ hits Netflix on Friday—here’s the trailer,2018-12-29
"What if the Dow fell another 4,000-plus points — would you be prepared?",2018-12-29
"‘Aquaman’ again tops box office, as Christmas bump adds to record year",2018-12-30
Dow Gains 265 Points Because 2018 Is Finally Over,2018-12-31
"Activision Blizzard wants to fire its CFO, who may be going to Netflix",2018-12-31
"CES, Netflix, and Other Things to Watch for in January",2019-01-01
"Apple cuts holiday sales forecast on iPhone and China weakness, stock falls 8%",2019-01-02
U.S. stocks kick off 2019 on a positive note in volatile session,2019-01-02
Roku Hopes a New Look Will Make It Easier to Buy Premium Content,2019-01-02
Netflix hires former Activision Blizzard CFO Spencer Neumann to be new chief financial officer,2019-01-02
"Tesla Stock Slides, Activision Slips and 5 More Wednesday Morning Movers",2019-01-02
A Netflix Stock Bull Trims the Price Target on Lack Of Subscriber Upside,2019-01-02
Netflix is no longer allowing users pay through Apple's iTunes,2019-01-02
Netflix removes satirical show episode in Saudi Arabia after complaint from Riyadh: reports,2019-01-02
Activision names former CFO Dennis Durkin as new CFO,2019-01-02
Netflix shares down 2% premarket as SunTrust slashes stock price target,2019-01-02
Netflix shares down 1.7% premarket,2019-01-02
Netflix stock price target cut to $355 vs. $410 at SunTrust Robinson Humphrey,2019-01-02
Netflix stock price target cut to $355 from $410 at SunTrust RH,2019-01-02
Netflix: Nearly one-third of subscribers watched ‘Bird Box’ in first week,2019-01-02
CBS and Viacom Start 2019 With Some Good News,2019-01-02
Netflix’s Reed Hastings and Ted Sarandos to get $31.5 million in compensation in 2019,2019-01-02
The best and worst stocks of 2018,2019-01-03
Square hires Blizzard executive Amrita Ahuja as CFO,2019-01-03
The woman who nailed 2018 stock-market volatility blowup now warns of ‘bubbliciouness’ in loans,2019-01-03
"Disney’s Bob Iger Talks Streaming, Park Plans, and Learning From Kodak",2019-01-04
"Dow closes more than 700 points higher as investors cheer jobs data, Powell comments",2019-01-04
Netflix's stock surges into bull-market territory,2019-01-04
Goldman Sachs Is Upbeat About Netflix and Other Internet Stocks,2019-01-04
U[PDATE: Netflix shares soar 9% as Goldman adds stock to its Conviction List,2019-01-04
"Square Gets a New CFO, Activision Loses Another Top Exec",2019-01-04
Stocks surge after robust jobs report and dovish Powell remarks,2019-01-04
Four Low P/E Stocks That Look Like Good Bets,2019-01-04
The biggest stock-market winners and losers on the best day for jobs news in 10 months,2019-01-05
Weekend roundup: Apple’s bomb | Scaramucci exclusive | Bold predictions for 2019,2019-01-05
Netflix to idiots: Don’t hurt yourself doing ‘Bird Box’ challenge,2019-01-06
‘Bohemian Rhapsody’ comes up big in upset-laden Golden Globe Awards,2019-01-06
Everything coming to Netflix in January — and what’s leaving,2019-01-06
Netflix shares rally after upbeat Goldman says stock’s a buy following pullback,2019-01-06
Netflix stock falls after SunTrust slashes price target,2019-01-06
Where to watch all the Golden Globe-nominated shows and films before Sunday,2019-01-06
Second 20-to-1 up day strengthens S&P 500’s ‘near-term’ recovery attempt,2019-01-07
Big Media Deals That Could Happen in 2019—and Some That Won’t,2019-01-07
Netflix Stock Jumps on Upbeat Analyst Remarks,2019-01-07
"Netflix’s ‘Bird Box’ soars, opens eyes in Hollywood",2019-01-07
Netflix’s new CFO will earn nearly twice as much as his predecessor,2019-01-07
Hulu subscribers rise above 25 million,2019-01-08
Here’s how you should prepare for a bear market in stocks,2019-01-08
These early retirees bought their ‘disgusting’ house in Montana with cash and budget less than $1 a pound for food,2019-01-09
"For 2019, it’s about how to make money even if there’s a bear market",2019-01-09
"Video: Unhinged traveler calls JetBlue agent a ‘rapist,’ says she has a gun",2019-01-09
Netflix shares rise after hours following UBS upgrade,2019-01-10
Disney’s Bob Iger Asks Wall Street to Be Patient on Streaming: ‘Great Content’ Comes First,2019-01-10
"Q&A with Cody Willard: Apple, Disney, Adobe and small-cap stocks",2019-01-10
Here are the best Dow and S&P stocks so far in 2019,2019-01-11
Amazon Stock Is Down but Not Out as Strong Holiday Sales Could Drive a Rebound,2019-01-11
Netflix Stock Is Climbing in 2019 as Bulls Prep for Its Next Earnings Release,2019-01-11
Stock bounce? Don’t ‘lower your guard’ where this big risk is concerned,2019-01-11
"Urban Outfitters, Gap and 7 More Stocks Making Friday Morning Moves",2019-01-11
Netflix's stock surges as analysts upgrade ahead of earnings report,2019-01-11
Netflix stock price target cut to $450 from $435 at Raymond James,2019-01-11
Netflix upgraded to strong buy from outperform at Raymond James,2019-01-11
Stocks snap 5-day winning streak but log strong weekly gains,2019-01-11
"Netflix, Oil Gain but Stocks Pause After January Surge",2019-01-11
"Is the Netflix Hit Bird Box Worth $400 Million? That ‘Borders on Idiotic,’ Analyst Says.",2019-01-14
How NBC’s New Streaming Service Stacks Up Against the Competition,2019-01-14
NBCUniversal to launch ad-supported streaming service in 2020,2019-01-14
Netflix stock price target cut to $425 from $450 at J.P. Morgan,2019-01-14
"Amazon, Facebook, and Other Internet Stocks Are Good Buys, Analyst Says",2019-01-14
Apple's stock falls to lead Dow losers; analyst sees need for aggressive iPhone price cuts and 'significant' M&A,2019-01-14
"Money flows show Netflix, AMD and Amazon shares may rocket on good news",2019-01-14
Stocks close lower as China trade data spark more global economic worries,2019-01-14
Netflix shares soar 5% in early trade,2019-01-15
Investors are forgetting that the stock market owes them nothing,2019-01-15
"S&P 500 and Nasdaq gains, but Dow's move capped as JPMorgan's quarterly results disappoint",2019-01-15
"S&P 500 ends above 2,600 mark after Netflix-led tech rally",2019-01-15
Netflix rolls out biggest-ever price hike for streaming subscribers,2019-01-15
Tech Sector Leads the Way as U.S. Stocks Turn Higher,2019-01-15
"Netflix price hike could bring near-term muddiness but will likely pay off, analyst says",2019-01-15
"Netflix Is Hiking Prices, and Wall Street Loves the Idea",2019-01-15
‘This Is Just the Future.’ How a Data Firm Whose Stock Picks Beat the Market Does It.,2019-01-15
Netflix shares soar 5% on news of biggest -ever price increase for U.S. subscribers,2019-01-15
Stocks close higher as Netflix-led tech rally offsets JPMorgan disappointment,2019-01-15
Great things are expected for (most) FAANG stocks in 2019,2019-01-16
What NOT to do when you are selling your unwanted swag on eBay,2019-01-16
"If Wall Street busts higher again, this stock sector is a no-brainer",2019-01-16
Netflix being sued for $25 million over ‘Black Mirror’ Bandersnatch episode,2019-01-16
Sen. Marco Rubio rolls out online-privacy legislation,2019-01-16
Netflix Is Reporting Earnings Today. Here’s What to Expect.,2019-01-16
Netflix Stock Falls on Earnings Despite Solid Subscriber Growth,2019-01-17
Netflix earnings: Can the streaming giant clear a high bar of investor expectations for a change?,2019-01-17
Netflix probably won’t answer these 8 questions when it releases earnings today,2019-01-17
Steve Carell and ‘The Office’ producers get back together for Netflix show ‘Space Force’,2019-01-17
The ‘eye of the storm’: SocGen says it can’t warn about stock-market problem enough,2019-01-17
Netflix's stock falls 0.7% ahead of Q4 results after the close,2019-01-17
"Netflix stock options prepped for big post-earnings move relative to FAANG peers, but not itself",2019-01-17
Netflix Earnings Could Make or Break the Internet-Stock Rebound,2019-01-17
Netflix stock falls after earnings,2019-01-17
Electronic Arts and Activision Are Struggling to Survive a Fortnite World,2019-01-18
"Dow Surges 336 Points, Capping a 4-Session Hope-Fueled Streak",2019-01-18
A study finds Netflix is right — videogames are a competitor to TV watching and streaming,2019-01-18
Stocks close higher for fourth day as optimism mounts over U.S.-China trade,2019-01-18
Dow logs 300-point gain as stocks string together four-day winning streak,2019-01-18
Netflix Price Targets Are Rising on Strong Earnings Even If The Stock Isn’t,2019-01-18
Netflix stock price target raised to $415 from $400 at Canaccord Genuity,2019-01-18
Netflix stock price target raised to $450 from $430 at Morgan Stanley,2019-01-18
Office REITs at Bargain Prices,2019-01-18
Netflix stock price target raised to $463 from $459 at Instinet,2019-01-18
Netflix stock price target raised to $320 from $300 at Instinet,2019-01-18
"Netflix earnings and subscriber additions beat expectations, but stock falls",2019-01-18
"Tesla, Netflix Fall as Stock Futures Rise on Trade-Deal Hopes",2019-01-18
Netflix's stock drop after results despite upbeat analyst calls,2019-01-18
Netflix's stock falls 3.1% premarket after Q4 results late Thursday,2019-01-18
Netflix stock price target raised to $440 from $430 at Monness Crespi Hardt,2019-01-18
Netflix stock price target raised to $165 from $150 at Wedbush,2019-01-18
Netflix stock price target raised to $435 from $425 at J.P. Morgan,2019-01-18
Netflix stock price target raised to $400 from $380 at Stifel Nicolaus,2019-01-18
Netflix stock price target raised to $440 from $430 at PiperJaffray,2019-01-18
Netflix stock price target raised to $470 from $450 at Raymond James,2019-01-18
Netflix stock price target raised to $425 from $410 at Oppenheimer,2019-01-18
Netflix stock price target raised to $420 from $410 at UBS,2019-01-18
This may be an even bigger issue for Netflix than the $2-a-month price hike,2019-01-19
Netflix thinks ‘Fortnite’ is a bigger competitor than other streaming services,2019-01-19
Are you tired of Marie Kondo’s ‘does it spark joy’ question? Here are 5 other ways to declutter,2019-01-19
"Apple has its problems but the App Store isn’t one of them, says Bernstein",2019-01-20
Netflix stock falls but analysts get even more bullish,2019-01-20
Here are the Oscar nominees — ‘Favourite’ and ‘Roma’ lead with 10 each,2019-01-22
How furloughed federal workers can rebuild their finances after the shutdown,2019-01-22
Netflix becomes first streaming service to join MPAA,2019-01-22
"McConnell tries to flip the script in shutdown with Thursday votes | Ocasio-Cortez, other ‘progressive flamethrowers’ join House Oversight Committee",2019-01-23
"Investors have seen the best Netflix and Amazon shares have to offer, says this money manager",2019-01-23
Hulu Cuts Low-End Plan Price After Netflix Raises Monthly Fees,2019-01-23
Who inherits your bitcoin and other digital assets?,2019-01-23
"Hulu cuts base subscription price by 25%, Netflix shares extend fall",2019-01-23
"FANG stocks are all stuck between 2 key moving averages, while Apple is below both",2019-01-23
Companies with visionary leaders are hurt if the CEO and chairman roles are split,2019-01-23
"Trump, in a bind on trade, will determine the direction of the stock market",2019-01-24
This Apple Bull Isn’t Upbeat About iPhone Sales,2019-01-24
The sneaky way some daters save money on Netflix,2019-01-26
Netflix shares edge lower after rival Hulu cuts prices,2019-01-26
The 15 Companies Least Vulnerable to Climate Change Risk,2019-01-28
The global dominators you invest in when Apple and the chips are down,2019-01-29
Unpopular take: Giant tech companies should pay taxes,2019-01-29
"Apple earnings: With iPhone sales flagging, Apple needs big new offering to excite its base",2019-01-29
AT&T Stock Is Down Significantly After Subscriber Numbers Fall Short,2019-01-30
Why the Netflix Price Hike Should Worry Investors,2019-01-30
Microsoft’s coming ‘death cross’ is the last for the tech heavyweights,2019-01-30
Amazon Earnings Will Show How Worried Rivals Should Be,2019-01-30
"Debt Could Hurt Netflix, GM, and CBS Stock, Bernstein Says",2019-01-31
Netflix Will Keep Growing Because None of Us Can Stop Watching Screens,2019-01-31
Canada attacks Netflix for using real disaster footage in ‘Bird Box’,2019-01-31
Dow Gains 327 Points as Powell Powers Market,2019-02-01
Individual investors were on a shopping spree for stock-market bargains in January: E-Trade,2019-02-01
Stock Picking Is Back—Sort Of,2019-02-01
Disney and Alphabet highlight another big week of earnings,2019-02-04
The ‘easy 10%’ has already been made — now get ready for February (gulp),2019-02-04
"Apple Should Buy Netflix or These 2 Other Companies, JPMorgan Says",2019-02-04
"Netflix is juicing its viewership numbers, FX chief says",2019-02-04
Viacom Stock Recovers as Earnings Report Shows Mixed Results,2019-02-05
Iger offers new details of Disney's digital plans,2019-02-05
Disney Stock Rises Because Earnings Were Good Enough...for a Transition Year,2019-02-05
Netflix Stock Could Get a Boost From the Return of Hit Shows,2019-02-05
"Alphabet, unlike Amazon, doesn’t get a pass on spending — does that make it a better investment?",2019-02-06
Why Disney Stock Is Holding Steady Even Though Earnings Fell,2019-02-06
"If you own Apple, Amazon, Facebook or AMD, look out below",2019-02-07
Hedge-fund manager Doug Kass says stock-market bulls need to wake up,2019-02-07
T-Mobile Stock Jumps Because Earnings Show It’s Doing Just Fine on Its Own,2019-02-07
Channel your creative urges into one of these well-paying side hustles,2019-02-07
Amazon should buy Netflix — and 9 other mergers we’d love to see,2019-02-09
7 myths FIRE haters perpetuate about the early-retirement movement,2019-02-09
"Third Point drops stakes in Alibaba, Microsoft and Netflix in fourth quarter",2019-02-09
Honeywell’s Pension Bought Up GE Stock and Doubled Down on Netflix,2019-02-11
Don’t expect WarnerMedia to share ‘Friends’ or other hit shows with Netflix for much longer,2019-02-11
Facebook and Costco Have Strong Balance Sheets. That Might Be a Problem for Their Stocks.,2019-02-12
Here’s why hedge-fund manager Kyle Bass thinks U.S. stocks will be lower by end 2019,2019-02-12
Emerging-market stocks are the ‘most crowded trade’ for first time on record,2019-02-12
Here are the stock market’s biggest winners as Washington (apparently) avoids another shutdown,2019-02-13
CBS Stock Falls Because Keeping Up With Netflix Is Expensive,2019-02-14
"CBS counting on NFL, surge in streaming users",2019-02-14
Disney overtakes Apple in survey of most ‘intimate’ brands,2019-02-14
Amazon Is a Risk for Almost Every Stock and Sector,2019-02-15
"How Subscription Services Could Charge to the Rescue for Apple Stock, According to an Analyst",2019-02-15
"Apple’s Streaming Services Won’t Save the Company, Even If It Tops What Netflix Has Now, Says Analyst",2019-02-15
Why Momentum Stocks Have Lost Their Momentum,2019-02-15
"Charting a primary trend shift: S&P 500, Nasdaq reclaim 200-day average",2019-02-19
"Charting a primary trend shift: S&P 500, Nasdaq reclaim 200-day average",2019-02-19
Here’s why Reddit’s co-founder has made paternity leave a priority,2019-02-20
"Netflix is the only 'FAANG' stock above its 200-DMA, others are still in technical limbo",2019-02-20
"Netflix's stock gains 0.5% premarket, after closing Tuesday at a 4-mo. high",2019-02-20
Two cheers for billionaires — they’ve made life so much better for us,2019-02-20
10 most popular stocks among hedge funds,2019-02-20
"Apple Should Buy CBS or These 6 Other Companies, Analyst Says",2019-02-21
9 stocks with dividend yields over 4% in a sector that often beats the broader market,2019-02-21
"Kraft Heinz Stock’s Plunge, Goodwill, and 2 More Things to Know About the Stock Market",2019-02-22
The best way to get rich is to invest in good bosses,2019-02-22
Netflix Disrupts the Theaters as Roma Wins Hollywood’s Esteem,2019-02-22
Netflix Could Win Big at the Oscars for ‘Roma.’ That’s Trouble for Movie Theaters.,2019-02-22
"Zillow is betting big on flipping houses, and investors seem to like it",2019-02-23
Kicking yourself for missing the recent rally? Here are 5 reasons you shouldn’t,2019-02-24
‘How to Train Your Dragon’ sequel toasts box-office competition,2019-02-24
2019 Oscars: ‘Green Book’ is surprise best-picture winner,2019-02-24
A tip you can use to make money from Warren Buffett’s multibillion-dollar loss,2019-02-25
"Spark Therapeutics Stock Doubles, Netflix Gains, and More Monday Morning Movers",2019-02-25
Netflix Was a Big Oscar Winner Even If Roma Didn’t Win Best Picture,2019-02-25
"An Apple Streaming Service Might Not Be Worth Getting Excited About, Analyst Says",2019-02-25
Dell returns to the earnings calendar as retailers’ holiday returns keep flowing,2019-02-25
How a new crop of tech IPOs may steal sentiment from FAANG stocks,2019-02-25
"These 4 Internet Stocks Are Still Top Picks, JPMorgan Says",2019-02-26
Federal appeals court allows $81 billion AT&T takeover of Time Warner,2019-02-26
"Netflix Stock to Rally Because It Can Raise Prices, Says Analyst",2019-02-26
Discovery Stock Falls on Murky 2019 Guidance,2019-02-26
Mutual Funds Raise Stake in Apple and Other Tech Stocks,2019-02-26
"Podcast: A $16 Billion Hemp Opportunity, and Two Other Numbers You Need to Know",2019-02-27
Comedian Hasan Minhaj on student debt: ‘This system has become broken’,2019-02-27
"Why America Is Obsessed With Theranos, Fyre Fest, and Other Scams",2019-02-28
Disney Is Reportedly Eyeing AT&T’s Stake in Hulu as a Dizzying M&A Run for Media Continues,2019-02-28
Why paid family leave is about more than taking care of babies,2019-02-28
The Netflix of China Might Just Be Wishful Thinking,2019-03-01
The U.S. stock market has now split into the ‘haves’ and ‘have nots’,2019-03-02
AT&T’s WarnerMedia to compete with Netflix by focusing on streaming,2019-03-04
Spielberg backing of Oscar ban for Netflix turns up temperature in Hollywood debate,2019-03-04
"Love Netflix? Then this stock is a no-brainer, says wealth manager Ross Gerber",2019-03-05
Bull-market’s 10th anniversary: the best (and worst) stocks over that run,2019-03-06
"How Many Streaming Subscribers Can Disney+ Get? More Than Netflix Has, Analyst Says",2019-03-06
Netflix to make García Márquez novel ‘One Hundred Years of Solitude’ into a series,2019-03-06
There’s a Chance of ‘Upside’ for Netflix’s First-Quarter Subscriber Growth,2019-03-07
"Netflix tracking toward 'strong' Q1 subscriber growth, analyst says",2019-03-07
The Dow Is Down 122 Points Because There’s Less Room for Optimism,2019-03-08
Amazon-led group said to be closing in on $3.5 billion deal for New York’s YES sports network,2019-03-08
Netflix downgraded to neutral vs. buy at Buckingham,2019-03-08
Competition Could Hit Netflix’s Subscriber Growth — but Not Its Pricing Power,2019-03-08
Netflix shares fall premarket after Buckingham downgrades stock to neutral from buy,2019-03-08
I Want to Stop Liking Microsoft Again. Why Is It So Hard?,2019-03-08
"A Top Fund Manager on Huge Upside for Netflix, Getting Out of Apple, and Using ‘an Army’ to Beat the Market",2019-03-08
Netflix shares fall 1.6% premarket,2019-03-08
"The ‘smart money’ prefers Alibaba over Amazon, Intel over AMD, and Google over Apple",2019-03-11
Apple should consider a big M&A deal to catch up on rivals in streaming: Wedbush analyst,2019-03-12
"Apple’s Streaming Service Could Win 100 Million Subscriptions, Analyst Says",2019-03-12
Here’s the One Thing That Could Make Streaming Bad for Videogame Stocks,2019-03-12
Investing app Stash launches debit rewards in an effort to attract more banking customers,2019-03-12
Northern Ireland is taking a ‘business as usual’ approach as Brexit looms,2019-03-12
Analyst Who Called Netflix’s Rise Sees ‘Dramatic Returns’ for Spotify,2019-03-12
"AT&T hikes prices, cuts channels for DirecTV Now streaming package",2019-03-13
Take-Two Stock Drops as Sony Buyout Rumors Cool Off,2019-03-14
Fans mourn as Netflix cancels ‘One Day at a Time’ reboot,2019-03-14
"If you’re tracking the S&P 500 instead of this fund, you’re leaving money on the table",2019-03-15
Why some investors say tech stocks are becoming less risky,2019-03-15
"Apple streaming service won't offer Netflix subscription, Hastings says",2019-03-18
Amazon's stock surges above 200-day moving average,2019-03-18
Facebook stock falls as worry of ‘negative network effects’ prompts downgrade,2019-03-18
Netflix Says ‘No’ to Apple’s Streaming Service,2019-03-19
"First-quarter earnings will be a ‘show-me’ moment for stocks, says BlackRock",2019-03-19
"New Fox names board of directors, begins trading",2019-03-19
Netflix Stock Could Keep Surging Because It Truly Is a Global Company,2019-03-20
AMD’s stock moves into risky territory on Google gaming hype,2019-03-20
Apple’s Stock Is Rising as Its Next Big Announcement Nears,2019-03-21
David Letterman says he stayed on TV so long because nobody had the guts to fire him,2019-03-21
"S&P 500, Nasdaq nail the breakout point, sustain break to ‘clear skies’ territory",2019-03-21
TV Streaming Is Too Fragmented and Too Complicated,2019-03-22
Gaming Meets the Cloud and Investors Scramble to Catch Up,2019-03-22
Apple Is Betting on Streaming. Here’s Who Wins and Who Loses.,2019-03-22
Apple stock boosted by ‘strong buy’ call ahead of special press event,2019-03-24
"Stocks took a big hit Friday, and these shares fell the most",2019-03-24
"Trump’s Mueller victory, the yield curve and slowing growth — here’s how to navigate the stock market",2019-03-25
Why Netflix Won’t Be Disrupted by New Competition From Apple,2019-03-25
"Netflix's stock rallies, erasing previous losses after Apple announces rival streaming service",2019-03-25
Viacom Stock Gains Because CBS Merger Rumors Heat Up...Again,2019-03-26
Apple says its new streaming platform will respect your digital boundaries,2019-03-26
Roku Stock Is Giving Back Its Post-Apple TV News Gains,2019-03-26
"The New Apple TV Streaming Service Could Be a ‘Netflix Killer,’ Analyst Says",2019-03-26
All the Businesses Apple Wants to Disrupt — and Whether It Can,2019-03-26
Apple leaves a lot of questions about its subscription services unanswered,2019-03-26
"Apple targets payments, news, TV and videogames in event detailing new subscription services",2019-03-26
Apple’s new services could either be Netflix ‘poison’ or barely meaningful,2019-03-27
Netflix’s Challenge in India: The Competition Is Cheaper,2019-03-27
Senator Sheldon Whitehouse Bought AT&T Stock and Sold Facebook,2019-03-28
How to ‘Marie Kondo’ your subscriptions with the click of a button,2019-03-28
"Facebook, Amazon, other internet giants are weathering Washington’s body blows",2019-03-28
AT&T and Verizon Are Going in Opposite Directions. Here’s the One to Buy.,2019-03-29
"Apple Has $130 Billion in the Bank, So Why Is It Being So Frugal With Streaming TV?",2019-03-29
"Netflix, Starbucks, and 7 Other Stocks to Watch in April",2019-04-01
"Netflix Stock Will Keep Surging With Strong Shows, Says JPMorgan",2019-04-02
"Disney, Not Netflix, Is the Best Streaming Stock Today, Analyst Says",2019-04-02
Justice Department reportedly warns Academy against blocking Netflix at the Oscars,2019-04-02
Netflix’s stock now a ‘top pick’ at J.P. Morgan,2019-04-03
Consider these five China investments as trade talks progress,2019-04-03
"U.S. stocks ‘vulnerable to a correction,’ warns top asset manager",2019-04-03
T-Mobile Plans to Shake Up TV By Streaming Comedy Central and MTV,2019-04-03
"Helen Mirren: ‘I love Netflix, but f— Netflix’",2019-04-03
"Europe Might Be Next for Higher Netflix Prices, Analyst Says",2019-04-03
"Snapchat parent is getting into gaming, ratcheting up battle royale with ‘Fortnite’",2019-04-04
Disney Stock Is Rising Because Investors Like Its Chances Against Netflix,2019-04-04
S&P 500 extends win streak to 6th session as U.S.-China trade talks intensify,2019-04-04
The ‘smart money’ is buying only five of 11 popular tech stocks — and selling one,2019-04-04
"3 Reasons Apple and Disney Won’t Dethrone Netflix in Streaming, According to an Analyst",2019-04-05
Stem the costly tide of subscription creep,2019-04-05
"Snap stock gains after new features, but can they make money?",2019-04-05
A little-known risk to Apple is 5G cellular technology,2019-04-08
Disney Is About to Reveal More About Its Streaming Plans. Here’s What You Need to Know.,2019-04-09
"The start of a new rally for oil prices? Not so fast, says this strategist",2019-04-09
Netflix Could Actually Benefit From Increased Competition. Here’s Why.,2019-04-09
Disney Stock Is Rising Because It Could Break Out of Its Range Soon,2019-04-09
