Headline,Date
Investors Chasing Faster Growth Look Abroad,2017-08-18
A New Idea for Netflix: ‘Movie of the Week’,2017-08-18
Disney’s Kids Service Is No Sure Thing,2017-08-18
This market leader was the most-purchased stock by hedge funds last quarter,2017-08-18
"Nvidia, Facebook and 13 other companies are the real earnings-season winners",2017-08-18
Emma Stone overtakes Jennifer Lawrence to become highest-paid actress in Hollywood,2017-08-18
We asked financial advisers: How realistic is Netflix’s show ‘Ozark’?,2017-08-19
"Netflix wants exclusive rights to films, TV shows and the talent creating them",2017-08-19
Weekend roundup: Wells Fargo and its auditor | The back-pain racket | Going back to the movies,2017-08-19
Apple’s TV Target Isn’t Netflix or Amazon,2017-08-21
"Investors Favor Facebook, Amazon, Alphabet",2017-08-23
"Apple’s $1 billion TV move pits company against Spotify, not Netflix",2017-08-23
Not all FAANG stocks are created equal — here’s a ranking of best to worst,2017-08-24
MoviePass has struggled to meet demand for its $10-a-month movie-ticket deal,2017-08-24
Bracing for the Aging Bull Market’s Last Hurrah,2017-08-26
Netflix depends less and less on licensed content from the likes of Disney,2017-08-27
"Best TV Networks: Facebook, Alphabet, Netflix",2017-08-28
Apple TV Isn't Trying to Compete With Netflix,2017-08-29
Netflix shares are up 3% in afternoon trade,2017-08-30
"Like Amazon, these seven stocks have dropped 10% or more in a month — and analysts say buy them too",2017-08-31
Earnings season is still a headache and shareholders shouldn’t stand for it,2017-08-31
These 2 simple indicators say stocks are headed up,2017-08-31
The Crowded Trades of a Scary September,2017-09-01
Finding Opportunity in High-Yield Bonds,2017-09-01
"D.E. Shaw Buys Alibaba, Sirius, Intel; Sells Amazon",2017-09-01
Netflix lands new musical series from 'La La Land' director Damien Chazelle,2017-09-01
"Everything new on Netflix in September, and what’s leaving",2017-09-03
"Tim Cook tweets support for ‘Dreamers,’ says 250 work for Apple",2017-09-03
T-Mobile announces new promotion featuring free Netflix subscription with family plan,2017-09-06
Shares of Netflix are up 2.6%,2017-09-06
How to get returns out of this high-valuation market according to Goldman Sachs,2017-09-06
T-Mobile Has a New Plan: Free Netflix,2017-09-06
"The Dow’s first stop could be 4,000 points lower if there’s a real selloff",2017-09-07
Netflix's deal with T-Mobile could add 1 million new subscribers in the U.S.,2017-09-07
T-Mobile to offer free Netflix subscriptions to stand out in competitive wireless landscape,2017-09-08
"Roku is launching its own free, ad-supported movie channel",2017-09-08
Why a big budget is fatal at the box office for Stephen King movies,2017-09-08
ASML and SAP: Euro Tech Stocks in the FANG Class,2017-09-09
This is what happens when you pay women to take maternity leave,2017-09-12
"AT&T offering free HBO to combat T-Mobile, competitive mobile space",2017-09-12
Netflix’s Overseas Adventures Should Pay Off,2017-09-12
"What would happen if the DNS, the ‘phone book’ of the internet, were compromised?",2017-09-12
Tired of the FANG gang? These 2 tech stocks look like they’re in the same class,2017-09-12
Emmys 2017: A streaming vs. traditional TV showdown,2017-09-13
These three catalysts will push Apple’s stock to over $200,2017-09-14
What you don’t know about Martin Shkreli — his investing tips and strategies,2017-09-14
How ‘Tomb Raider’ inspired Angelina Jolie’s unflinching new Cambodian film,2017-09-15
Wall Street’s Real Earnings Surprises,2017-09-15
This teflon stock market fells another star hedge-fund manager — here’s his advice,2017-09-15
How Adam Sandler convinced Netflix to spend $12.5 million on indie film ‘Mudbound’,2017-09-15
"Hulu is spending more than Facebook and Apple, but far less than Netflix on content",2017-09-15
Emmys 2017: Here are the top 5 races to watch,2017-09-17
The FAANG companies are starting to turn against one another,2017-09-18
"Analysts have raised, or lowered, their price targets the most on these U.S. stocks",2017-09-18
"Lady Gaga postpones European tour due to fibromyalgia, which is the focus of her Netflix documentary",2017-09-18
Why Netflix Doesn’t Need Hot Shows To Keep Growing,2017-09-18
"How Amazon’s stock could rise to $3,000 — or fall to $400",2017-09-19
Netflix demands shutdown of Chicago bar? Stranger things have happened,2017-09-21
Why Netflix should be losing sleep over Hulu’s Emmy wins for ‘The Handmaid’s Tale’,2017-09-21
Why Netflix Doesn't Need Hot Shows to Keep Growing,2017-09-21
"Jim Rogers: When this bull market ends, ‘you don’t want the 26-year-old around’",2017-09-21
Insiders love these 14 retail stocks hit by the Amazon.com wrecking ball,2017-09-22
Want to be happier? Buy some time,2017-09-22
Weekend roundup: Uber’s London blowup | Your financial health | FAANG companies fight,2017-09-24
This is (probably) how low Apple’s stock will go,2017-09-25
Can Star Trek Take CBS Where Netflix Has Already Gone?,2017-09-25
Here’s why value stocks are starting to outperform growth,2017-09-26
"Now that the ‘smart money’ has stopped selling hot tech stocks, look for a bounce",2017-09-26
6 reasons why inflation will stay low — and how to capitalize on it,2017-09-27
Netflix initiated with outperform rating and $230 price target at Wells Fargo,2017-09-27
A Model 3 fail could lead to ‘moment of panic’ for Tesla: Bernstein,2017-09-28
What Is the Most Popular Video-Streaming Service?,2017-09-28
Netflix uses frame-by-frame machine learning to decide what you really want to watch,2017-09-28
Netflix is putting down roots in Canada,2017-09-28
Roku IPO: 5 things to know about the streaming device company,2017-09-29
"After booming IPO, Roku thinks this is the future of the company",2017-09-29
Roku IPO valuation nearly doubles in two sessions,2017-09-29
Tech Giants Play the Game of Thrones,2017-09-30
What Amazon Will Destroy Next,2017-09-30
Time for Biotech ETFs,2017-09-30
Dyson says it can do for electric cars what it did for vacuums,2017-10-01
These companies are expected to increase sales the most in 2018,2017-10-02
"Roku Lowers the Price on 4K, but Does It Matter?",2017-10-02
"Both market and tech’s gains are broader than appreciated, analyst says",2017-10-02
Netflix stock price target raised to $225 from $190 at UBS,2017-10-04
Netflix's stock surges 2.9% in morning trade,2017-10-04
Netflix shares gain nearly 4% after analysts say Q3 subscriber growth looks better than expected,2017-10-04
Netflix Rising: A $225 Stock?,2017-10-04
Netflix might add more subscribers than expected in the third quarter,2017-10-04
Gains have been so broad this year that nearly all investors have something to celebrate,2017-10-04
Dow ends at a fresh record; S&P 500 posts best record streak in 20 years,2017-10-05
A Netflix Price Hike? Investors Love It,2017-10-05
Netflix shares up nearly 4% after company raises subscription prices,2017-10-05
Can ‘Star Trek: Discovery’ help make CBS’s stand-alone streaming pursuit successful?,2017-10-05
Netflix is increasing subscription prices for new members,2017-10-05
"Public institutions must adapt, or lose effectiveness and credibility",2017-10-05
Almost All Mutual Fund Groups Rose in Third Quarter,2017-10-06
"Stocks Hit New Highs, as the Bull Trots Steadily On",2017-10-06
Tinder Strikes Gold With New Subscription Feature,2017-10-06
Why Network Execs Already Have Reason to Worry About the New TV Season,2017-10-06
How Netflix Is Learning from a Past Mistake,2017-10-06
Netflix Stock Seen Topping $200,2017-10-06
Netflix shares hit all-time intraday high of $195.34,2017-10-06
Tesla’s Elon Musk is ‘full of crap’ on self-driving cars — according to a GM exec,2017-10-06
Netflix is raising the cost of subscriptions again,2017-10-06
"Everything new on Netflix in October, and what’s leaving",2017-10-06
Netflix shares edge up premarket after Wedbush raises price target to $88 from $82,2017-10-06
Netflix stock price target raised to $88 vs. 482 at Wedbush,2017-10-06
"S&P 500, Nasdaq nail technical targets — S&P 2,550 and Nasdaq 6,580",2017-10-06
Why retirement can be a dangerous time,2017-10-07
Did Netflix choose the perfect time for a price increase?,2017-10-08
"As fans throng to New York Comic Con, these comic books sell for millions of dollars",2017-10-09
Netflix: Content Companies Can’t Cut it Off,2017-10-10
Wall Street is underestimating just how volatile 3rd quarter earnings season could be,2017-10-11
"Teens are spending their money on Amazon and Adidas, while Nike loses favor",2017-10-12
Netflix stock price target raised to $230 from $200 at Stifel Nicolaus,2017-10-12
Do viewers care what networks air their favorite TV show?,2017-10-12
Netflix stock price target raised to $225 from $210 at J.P. Morgan,2017-10-13
Netflix price target raised at J.P. Morgan ahead of next week's earnings,2017-10-13
Shares of Netflix break above $200 for the first time,2017-10-13
"Netflix Earnings Preview: No Big Hits, No Problem?",2017-10-13
How Google Can Play Catch-Up in the Cloud,2017-10-13
Netflix Inc. Q3 FactSet revenue consensus $2.97 bln,2017-10-16
Netflix shares gain after company adds more subscribers than expected in Q3,2017-10-16
Netflix shares up 2% after company reports Q3 earnings,2017-10-16
Netflix Inc. adds more subscribers than expected in third quarter,2017-10-16
Netflix Inc. Q3 revenue $2.98 bln vs. $2.29 bln,2017-10-16
Netflix: Going It Alone Is Not a Problem,2017-10-16
Netflix Inc. 5.3 million subscribers adds vs. 3.6 million a year ago,2017-10-16
Netflix Inc. Q3 EPS 29 cents vs. 12 cents; FactSet consensus 32 cents,2017-10-16
Oil headed to $10? China may be in the driver’s seat,2017-10-16
How being a cheapskate became ‘sexy’,2017-10-16
Netflix earnings: Why higher subscription prices lead to more shows like ‘Stranger Things’,2017-10-16
"Six similarities between now and 1987, when the Dow plummeted 23% in one day",2017-10-16
Netflix Inc. adds 5.3 million streaming subscribers in Q3,2017-10-16
Netflix's stock surges 1.5% premarket toward record high after Q3 results late Monday,2017-10-17
Netflix: 4 Things We Learned in the Last 24 Hours,2017-10-17
"Dow, S&P 500 end at records, boosted by health care stocks",2017-10-17
Netflix Bingeing On Subscriber Growth,2017-10-17
"Netflix shares show volatility as cash flow remains negative, but analysts see upside",2017-10-17
Netflix stock price target raised to $237 from $225 at UBS,2017-10-17
Netflix's stock hits all-time intraday high of $204.38 earlier,2017-10-17
"Netflix's stock swings higher, gains 0.8% after being down as much as 2.4% earlier",2017-10-17
Netflix plans huge movie push as it faces post-Disney reality,2017-10-17
"Netflix's stock falls 2.3%, reversing premarket gains of as much as 2.4%",2017-10-17
Netflix price target lifted to $230 from $206 at KeyBanc Capital,2017-10-17
Netflix stock price target raised to $250 from $210 at RBC Capital,2017-10-17
Netflix stock price target raised to $220 from $205 at Raymond James,2017-10-17
Netflix stock price target raised to $235 from $225 at Stifel Nicolaus,2017-10-17
"Vanguard’s boss has a warning for a market that’s hellbent on Dow 23,000",2017-10-17
Netflix stock price target raised to $93 from $88 at Wedbush,2017-10-17
Netflix stock price target raised to $242 from $225 at J.P. Morgan,2017-10-17
Netflix stock price target raised to $245 from $215 at Oppenheimer,2017-10-17
Why stock-market bulls shouldn’t sweat some bad earnings,2017-10-17
Netflix stock price target raised to $240 from $215 at Piper Jaffray,2017-10-17
Nielsen shares gain more than 4% after company announces new Netflix ratings service,2017-10-18
Nielsen finally offering networks desired insight into Netflix ratings,2017-10-18
Verizon earnings expected to focus on cord-cutting,2017-10-18
Here’s how to break down the billions Netflix spends on original movies and shows,2017-10-18
This fund manager says avoid Netflix altogether—don’t even short the stock,2017-10-19
Six differences in the stock market between today and 1987,2017-10-19
"U.S. stock futures tumble, with eBay, Apple, other tech stocks taking a hit in premarket",2017-10-19
"Amazon, Apple, Google and Facebook will all go away within 50 years, says author",2017-10-19
Sean Penn rips Netflix over ‘reckless’ El Chapo documentary,2017-10-20
Netflix shows that it has no real competitors,2017-10-21
Weekend roundup: Avoiding the student-loan trap | Looking back at Black Monday | Strategy to limit investment risk,2017-10-21
What could derail the stock-market rally? Here’s one thing to watch,2017-10-23
NetFlix to offer $1.6 bln in debt,2017-10-23
"NetFlix to use proceeds of debt offering for purposes including content acquisition, production",2017-10-23
"Netflix raising $1.6 billion in bond market to fuel content acquisition, production",2017-10-23
Is the next move for highflying Netflix stock off a cliff?,2017-10-23
Here’s how to get rich like Gates and Zuckerberg,2017-10-24
Netflix prices its biggest junk-bond sale yet to help fund aggressive slate of new shows and films,2017-10-24
Tesla slammed by Einhorn’s Greenlight Capital,2017-10-24
"EarningsWatch: Amazon, Alphabet and AMD form tech’s A list",2017-10-24
Roku closes at lowest price since IPO,2017-10-24
Netflix: Original Content Is Key,2017-10-24
New Netflix ‘Stranger Things 2’ ad is suitably spooky,2017-10-24
Here’s how Costco drove down grocery prices in Australia,2017-10-24
Hollywood has never seen competition like Netflix,2017-10-25
The 10 best cities for tech jobs,2017-10-26
Dan Rather says Trump’s conduct over call to Gold Star widow is ‘unforgivable’,2017-10-26
10 most expensive S&P 500 stocks with majority ‘buy’ ratings,2017-10-26
"Everything coming to Netflix in November, and what’s leaving",2017-10-27
"S&P 500, Nasdaq end at records as tech rally powers gains",2017-10-27
Reinventing Telecom,2017-10-27
Which stock is a better buy — Google or Amazon?,2017-10-28
FAANG Stocks Take a Bite Out of the Bears,2017-10-30
Netflix’s new junk bonds are already under water,2017-10-30
Actor Anthony Rapp says Kevin Spacey made sexual advances toward him at age 14,2017-10-30
Netflix has suspended production of 'House of Cards' season six indefinitely,2017-10-31
"As ‘House of Cards’ ends, what’s next for Kevin Spacey following sexual misconduct claims?",2017-10-31
The scary thing Hollywood does when it runs out of reboots — and not just on Halloween,2017-10-31
Mastercard CEO focuses on security,2017-10-31
Here’s a lower-risk strategy for an expensive stock market,2017-10-31
Netflix suspends production on ‘House of Cards’ season 6,2017-11-01
5 strange things about ‘Stranger Things’ season 2,2017-11-01
A new ETF tries turning market-cap weighting on its head,2017-11-01
Hollywood is still keeping black creators out of TV writers’ rooms,2017-11-02
Discovery Communications loses more subscribers,2017-11-02
"As Tech Giants Soar, Don’t Forget the Lilliputians",2017-11-03
Artificial Intelligence’s Winners and Losers,2017-11-03
10 wildly successful people and the surprising jobs that kick-started their careers,2017-11-03
Netflix says Nielsen’s ‘Stranger Things’ ratings might be ‘upside down’,2017-11-03
Netflix cuts ties with Kevin Spacey,2017-11-04
"Mark Cuban tells Kyle Bass AI will ‘change everything,’ and weighs in on bitcoin",2017-11-06
Three money managers who lived through the 1987 stock-market crash warn of danger today,2017-11-06
5 telltale signs this stock market’s ‘euphoria’ could be ready to blow up,2017-11-07
Dow’s 1-year gain since Trump’s win is its biggest post-Election Day rise since 1945,2017-11-08
The most important new thing about Apple is not the iPhone X,2017-11-08
"Apple picks up drama series starring Jennifer Aniston, Reese Witherspoon",2017-11-08
Disney escapes a post-earnings drop by using the Force — but it’s a trap,2017-11-10
Disney to charge 'substantially' less than Netflix for streaming,2017-11-10
This is what the stock market told us during the most recent dip,2017-11-10
Netflix scraps second Louis C.K. standup special,2017-11-10
The man who gave us the DVR says Roku is the future of TV,2017-11-14
Viacom and Charter are planning to make original programming,2017-11-15
3 winners and 3 losers in the streaming video wars of 2018,2017-11-16
IBM: Bargain Blue Chip,2017-11-18
Netflix’s new film ‘Mudbound’ is strong contender for a major award,2017-11-18
Weekend roundup: Tesla’s big splash | Retail’s opportunity | Eating turkey tails,2017-11-19
Bull market will need tax cuts to keep investors in the mood,2017-11-20
Even Adidas watches Netflix,2017-11-20
Cast members of new Broadway finance play ‘Junk’ share their own investing strategies,2017-11-20
Why renewed stock-market pessimism is a reason to be optimistic,2017-11-21
Jim Rogers says bitcoin ‘looks and smells’ like all other investment bubbles,2017-11-21
What Will It Take for Apple to Contend with Netflix and Amazon in Video?,2017-11-21
Are your medical records safe?,2017-11-21
"Netflix, Comcast, et al: FCC Chair Pai Vows to ‘Abandon’ a ‘Mistake’ on Net Neutrality",2017-11-21
"What $1,000 invested in each of these 15 popular stocks before the Great Recession looks like now",2017-11-21
"If you like the FAANGs, you’ll love these three year-end melt-up candidates",2017-11-22
Netflix 'publicly and loudly' opposes the FCC's net neutrality rule reversal,2017-11-22
Tencent Stock Still Has Lots of Upside,2017-11-24
"What Netflix, Comcast and others are saying about the FCC’s plan to end net neutrality",2017-11-24
"Why Roku, Up 200%, Could Keep Rocketing Higher",2017-11-27
"Roku stock continues rampage, closes up 18% after analyst raises price target",2017-11-27
"Everything coming to Netflix in December, and what’s leaving",2017-11-28
IAC CEO’s First Stock Sale: $10.1 Million,2017-11-28
Shares of Netflix are down 6%,2017-11-29
"Dow finishes at record, while Nasdaq posts worst day in 3 months on tech selloff",2017-11-29
"Beware, the ‘smart money’ isn’t interested in buying technology stocks",2017-11-30
Brace for more tech pain — and more cheer for the stock market’s sad sacks,2017-11-30
"Netflix has yet to reach its peak year for subscriber additions, analyst says",2017-11-30
Netflix stock price target raised to $245 from $230 at MKM Partners,2017-11-30
"High-flying tech stocks fall back toward earth, chip makers suffer worst day of year",2017-11-30
Fund manager looks beyond ‘FAANG’ stocks and finds even bigger winners for 2018,2017-12-01
WWE Gets Smart by Streaming,2017-12-01
Washington Whipsaws the Market,2017-12-01
"Get ready for Dow 30,000, but beware of ‘buy the rumor, sell the news’",2017-12-02
Portfolio managers are losing their enthusiasm for highflying tech stocks,2017-12-02
The S&P 500 has put another chapter in its historic march higher,2017-12-02
Consumer discretionary ETF hits record as retailers rally,2017-12-04
"Netflix will resume production of ‘House of Cards’ without Kevin Spacey, starring Robin Wright",2017-12-04
Netflix can shake off Kevin Spacey scandal — and ‘Stranger Things’ will help,2017-12-05
"If you’re panicking over tech stocks and taxes, here’s a good reason to stop",2017-12-05
"Shoe designer Steve Madden on his new movie documentary, bitcoin and his encounters with Donald Trump",2017-12-05
"Netflix coverage initiated at Evercore, analysts call valuation 'the elephant in the room'",2017-12-06
Netflix trends suggest it could add more subscribers in Q4 than expected; analyst says,2017-12-06
Now is the time for both stock and bond investors to loiter around the lifeboats,2017-12-06
What to consider when investing in Netflix today,2017-12-06
We’re still only in the early stages of stock-market euphoria,2017-12-07
A tale of two bubbles — the dot-coms and bitcoin,2017-12-07
Why drug and alcohol addiction stories on screen and stage are at an all-time high,2017-12-07
Disney: The Mouse Can Roar,2017-12-07
"These other red, white and blue stocks are ‘just breaking out’ after a lost decade",2017-12-07
This entrepreneur is ringing up sales restoring vintage telephones,2017-12-07
Cody Willard: I’m expecting weakness in the stock market,2017-12-08
Why 2018 Looks Like a Make-or-Break Year for TV,2017-12-08
Tap and Trade: Apps Target Young Investors,2017-12-08
‘The Shape of Water’ leads the Golden Globe nominations,2017-12-11
FAANG stocks unlikely to outperform in 2018: analyst,2017-12-11
'American Vandal' tops list of most-binged shows on Netflix in 2017,2017-12-11
Four lies about bitcoin futures that stock investors need to know,2017-12-12
Here are the Netflix shows people binge watch the most,2017-12-13
What could happen to FAANG stocks in a recession,2017-12-13
"Morgan Stanley bullish on FAANG stocks, but sees ‘yellow flags’ in 2018",2017-12-13
American women are angry and this new podcast wants to hear their stories,2017-12-13
"Disney closes in on deal to acquire 21st Century Fox’s movie, TV and sports assets",2017-12-13
Why the end of net neutrality isn’t the end of the internet,2017-12-14
Costco offering members MoviePass and streaming Fandor service for $89.99 a year,2017-12-14
Disney’s Fox deal sets the scene for brand new superhero battles,2017-12-14
FCC votes to roll back Obama-era 'net neutrality' regulations,2017-12-14
Hulu Makes the Disney-Fox Deal Extra Interesting,2017-12-14
Some nagging signs of stock-market trouble could be unleashed in January,2017-12-14
"Net neutrality repeal gets the internet all wrong, founders claim",2017-12-14
"Three stock winners, three losers in net neutrality ruling",2017-12-15
Hollywood gears up for ‘Bitcoin’ movies,2017-12-16
"Weekend roundup: Bitcoin, bitcoin and moire bitcoin | Extreme market calls | A happy inheritance dilemma",2017-12-17
"Netflix won’t get beat by a combined Disney-Fox company, analyst say",2017-12-18
Three important takeaways for investors in the Disney-Fox deal,2017-12-19
"Bitcoin once again the ‘world’s most crowded trade’, fund managers say",2017-12-19
A baker’s dozen of bargain-bin stocks held down by year-end tax-loss selling,2017-12-20
"Netflix Plans to Make More Movies Than Major Studios Combined, Says Wells",2017-12-21
"If you want to get rich, invest in Treasury bills, not FAANG stocks or bitcoin",2017-12-21
Here are seven new bitcoin-related stocks — most are bonkers,2017-12-22
10 financial lessons you can learn from holiday movies,2017-12-23
Here’s why investors may have to worry about Apple shares in 2018,2017-12-26
"Bitcoin $1 million, Amazon $1 trillion: Bold calls of 2017 are worth watching now",2017-12-26
Here’s Why Movies Matter to Streaming Services,2017-12-26
Theresa May’s government reportedly pleads with Prince Harry not to invite Obamas to wedding,2017-12-26
"Netflix gives executives a big raise, cites new tax law",2017-12-28
How these super savers put away half their income each month,2017-12-28
Netflix shares are up more than 3% in afternoon trade,2017-12-28
‘FAANG’ executives are selling their stocks — heed this warning sign,2017-12-28
Will the stock market’s Santa Claus Rally fail this year?,2017-12-28
"So Long 2017—Next Stop, Euphoria",2017-12-29
The Year Big Tech Became a Target,2017-12-29
Stock market struggles to end 2017's final trading day on a high note,2017-12-29
Here comes one more bullish S&P 500 call for 2018 — it’s all about earnings,2017-12-29
"Netflix gives some top executives big raise in salary, citing new tax law",2017-12-29
The fourth quarter continued 2017’s streak of broad-based stock strength,2017-12-29
Stocks end otherwise stellar 2017 on a down note,2017-12-29
Why Facebook May Consider a Cash Dividend,2017-12-29
"18 predictions for 2018 on the stock market, FAANGs and bitcoin",2017-12-30
Howard Gold: Why I was wrong on U.S. stocks in 2017,2017-12-30
Everything coming to Netflix in January — and what’s leaving,2017-12-31
Trump Today: President goes after familiar foes in tweet-storm,2018-01-02
How to potentially get a 30% return in three months with the ‘January Effect’,2018-01-02
"S&P 500, Nasdaq end at records in first trading day of 2018; chipmakers boost tech shares",2018-01-02
Netflix shares are up nearly 5%,2018-01-02
"What should investors worry about in 2018? Here’s a big, fat list of risk factors",2018-01-02
"TV networks, media companies need a streaming service to survive in 2018",2018-01-02
Netflix shares upgraded to outperform from neutral at Macquarie Research,2018-01-02
Netflix shares are up more than 3% after being upgraded to outperform at Macquarie,2018-01-02
Netflix shares gain premarket after upgrade at Macquarie Research,2018-01-02
How ‘Bright’ on Netflix compares to some of the biggest theatrical openings of 2017,2018-01-02
"Tech shares rally on first trading day of 2018 led by chips, software",2018-01-02
"Biggest Dow winners and losers in 2017: Boeing soars to record levels, GE slumps",2018-01-03
"Here’s how workers can keep their jobs, despite the inexorable rise of automation",2018-01-03
Netflix confirms sequel to blockbuster original film 'Bright',2018-01-03
Why investors are facing ‘the Icarus dilemma’ in 2018,2018-01-03
"These fatal flaws lurk at the heart of the bitcoin craze, says Mr. Money Mustache",2018-01-04
Technical signs still point to a rising stock market,2018-01-04
"Facebook, Amazon shares lead list of names to hit 52-week highs as Dow breaks above 25,000",2018-01-04
